Brainstem    UBERON:0002298,,,Spinal Cord    UBERON:0002240,,,,,,,,,,,,,,,,,Cranial Nerves    UBERON:0001785,Nerves (Also Includes Cranial),Nerve Roots Of Spinal Cord Segments,UBERON,Nieuwenhuys,Atlas Nomenclature,,,Peripheral Nervous System    UBERON:0000010
Midbrain    UBERON:0001891,Pons    UBERON:0000988,Medulla Oblongata    UBERON:0001896,Gross Anatomy,General Spinal Cord Anatomy,Internal Anatomy,Dorsal Root Gangla Of Spinal Segments,,,,Segment Anatomy,,,,,,,,,,Abducens Nerve    UBERON:0001646,Abdomen Nerve    UBERON:0003429,Ventral Nerve Root Of Cervical Spinal Cord    UBERON:0014634,Retrorubral Area Of Midbrain Reticular Nucleus    UBERON:0011172,Zonal allocation    Primary sensory and Primary Motor Nuclei    higher order centers,Allen Mouse Brainstem,Paxinos Rat Brainstem,Berman Cat Brainstem,Ganglia    UBERON:0000045
Retrorubral Area Of Midbrain Reticular Nucleus    UBERON:0011172,Root Of Abducens Nerve    UBERON:0002786,Inferior Olivary Complex    UBERON:0002127,Ampulla Caudalis    UBERON:0011360,C1 Segment Of Cervical Spinal Cord    UBERON:0006469,Accessory Nerve Fiber Bundle    UBERON:0006117,Cervical Dorsal Root Gangla,Thoracic Dorsal Root Ganglia    UBERON:0002835,Lumbar Dorsal Root Ganglia    UBERON:0002836,Sacral Dorsal Root Ganglia    UBERON:0002837,Lamina Of Spinal Cord,Spinal Cord Internal Structures Per Segment,,,,Spinal Cord Segments    UBERON:0005844,Spinal Cord Subsegments,,,,Accessory Nerve,Abducens Nerve    UBERON:0001646,Dorsal Nerve Root Of Cervical Spinal Cord    UBERON:0014635,Cerebral Peduncle    UBERON:0002623,"mes    III, nucleus nervi oculomotorii    rubm, nucleus ruber, pars magnocellularis",Abducens Nucleus (Mba)    MBA:653,10th cerebellar lobule (nodule) (paxrat)    PAXRAT:23,Abducens Nerve (Bercat)    BERCAT:1,Auditory Ganglion
Cerebral Peduncle    UBERON:0002623,Basal Part Of Pons    UBERON:0002567,Medullary Raphe Nuclear Complex    UBERON:0002692,Central Canal Of Spinal Cord    UBERON:0002291,C4 Segment Of Cervical Spinal Cord    UBERON:0006490,Accessory Nucleus    NLX:39810,Cervical Dorsal Root Gangla,Thoracic Dorsal Root Ganglia    UBERON:0002835,Lumbar Dorsal Root Ganglia    UBERON:0002836,Sacral Dorsal Root Ganglia    UBERON:0002837,Lamina Of Spinal Cord,Segment Part Of Cervical Spinal Cord    UBERON:0007714,Thoracic Segment Of Spinal Cord    UBERON:6000016,Segment Part Of Lumbar Spinal Cord    UBERON:0007716,Segment Part Of Sacral Spinal Cord    UBERON:0007717,Cervical Spinal Cord    UBERON:0002726,Cervical Spinal Cord    UBERON:0002726,Thoracic Spinal Cord    UBERON:0003038,Lumbar Spinal Cord    UBERON:0002792,Sacral Spinal Cord    UBERON:0005843,Facial Nerve    UBERON:0001647,Accessory Xi Nerve Cranial Component    UBERON:0009673,Ventral Nerve Root Of Thoracic Spinal Cord    UBERON:0014617,Oculomotor Nerve Root    UBERON:0002668,"EW, nucleus of Edinger–Westphal    sc, superior colliculus",Accessory Abducens Nucleus (Mba)    MBA:568,1st cerebellar lobule (lingula) (paxrat)    PAXRAT:1,Abducens Nucleus (Bercat)    BERCAT:2,Cervical Dorsal Root Ganglion    UBERON:0002834
Oculomotor Nerve Root    UBERON:0002668,Middle Cerebellar Peduncle    UBERON:0002152,Accessory Nerve Root    UBERON:0014615,Fasciculus Of Spinal Cord    UBERON:0005837,C7 Segment Of Cervical Spinal Cord    UBERON:0006493,Ampulla Caudalis    UBERON:0011360,First Cervical Dorsal Root Ganglion    UBERON:0002838,First Thoracic Dorsal Root Ganglion    UBERON:0002845,First Lumbar Dorsal Root Ganglion    UBERON:0002857,First Sacral Dorsal Root Ganglion    UBERON:0002860,Lamina I Of Gray Matter Of Spinal Cord    UBERON:0006118,Segment Part Of Cervical Spinal Cord    UBERON:0007714,Thoracic Segment Of Spinal Cord    UBERON:6000016,Segment Part Of Lumbar Spinal Cord    UBERON:0007716,Segment Part Of Sacral Spinal Cord    UBERON:0007717,Thoracic Spinal Cord    UBERON:0003038,Cervical Spinal Cord    UBERON:0002726,Thoracic Spinal Cord    UBERON:0003038,Lumbar Spinal Cord    UBERON:0002792,Sacral Spinal Cord    UBERON:0005843,Glossopharyngeal Nerve    UBERON:0001649,Accessory Xi Nerve Spinal Component    UBERON:0009674,Dorsal Nerve Root Of Thoracic Spinal Cord    UBERON:0014616,Midbrain Tegmentum    UBERON:0001943,"Vpr, nucleus sensorius principalis nervi trigemini    ic, inferior colliculus",Accessory Facial Motor Nucleus (Mba)    MBA:576,2b cerebellar lobule (paxrat)    PAXRAT:2,Accessory Dorsal Tegmental Nucleus (Bercat)    BERCAT:3,Ciliary Ganglion    UBERON:0002058
Midbrain Tegmentum    UBERON:0001943,Longitudinal Pontine Fibers    UBERON:0002732,Nucleus Of Solitary Tract    UBERON:0009050,Filum Terminale Externum    UBERON:0010270,C8 Segment Of Cervical Spinal Cord    UBERON:0006470,Apex Of Lumbar Spinal Cord Dorsal Horn    UBERON:0014632,Second Cervical Dorsal Root Ganglion    UBERON:0002839,Second Thoracic Dorsal Root Ganglion    UBERON:0002846,Second Lumbar Dorsal Root Ganglion    UBERON:0002856,Second Sacral Dorsal Root Ganglion    UBERON:0002861,Substantia Gelatinosa    UBERON:0002181,Cervical Spinal Cord Dorsal Horn    UBERON:0014620,Thoracic Spinal Cord Dorsal Column    UBERON:0005839,Lumbar Spinal Cord Dorsal Horn    UBERON:0014638,Sacral Spinal Cord Gray Matter    UBERON:0029503,Lumbar Spinal Cord    UBERON:0002792,C1 Segment Of Cervical Spinal Cord    UBERON:0006469,First Thoracic Spinal Cord Segment    UBERON:0006457,First Lumbar Spinal Cord Segment    UBERON:0006448,First Sacral Spinal Cord Segment    UBERON:0006460,Hypoglossal Nerve    UBERON:0001650,Accessory Xi Nerve    UBERON:0002019,Ventral Nerve Root Of Lumbar Spinal Cord    UBERON:0024382,Dorsal Tegmental Decussation    UBERON:0003009,"ist    IV, nucleus nervi trochlearis    is, nucleus isthmi",Accessory Olfactory Bulb (Mba)    MBA:151,2nd and 3rd cerebellar lobules (paxrat)    PAXRAT:3,Accessory Optic Tract (Bercat)    BERCAT:4,Cranial Ganglion Part Of Peripheral Nervous System
Dorsal Tegmental Decussation    UBERON:0003009,Transverse Pontine Fibers    UBERON:0002735,Hypoglossal Nerve Root    UBERON:0004675,Filum Terminale Internum    UBERON:0010269,Accessory Nerve Fiber Bundle    UBERON:0006117,Apex Of Thoracic Spinal Cord Dorsal Horn    UBERON:0014611,Third Cervical Dorsal Root Ganglion    UBERON:0002840,Third Thoracic Dorsal Root Ganglion    UBERON:0002847,Third Lumbar Dorsal Root Ganglion    UBERON:0002858,Third Sacral Dorsal Root Ganglion    UBERON:0002862,Lamina Iii Of Gray Matter Of Spinal Cord    UBERON:0016574,Cervical Spinal Cord Dorsal Column    UBERON:0005841,Thoracic Spinal Cord Dorsal Horn    UBERON:0014609,Lumbar Spinal Cord Dorsal Column    UBERON:0005842,Sacral Spinal Cord Lateral Column    UBERON:0005848,Sacral Spinal Cord    UBERON:0005843,C2 Segment Of Cervical Spinal Cord    UBERON:0006489,Second Thoracic Spinal Cord Segment    UBERON:0006458,Second Lumbar Spinal Cord Segment    UBERON:0006450,Second Sacral Spinal Cord Segment    UBERON:0006461,Oculomotor Nerve    UBERON:0001643,Ampullary Nerve    UBERON:2005144,Ventral Nerve Root Of Sacral Spinal Cord    UBERON:0023623,Lateral Pes Lemniscus    UBERON:0003010,"r1    ip, nucleus interpeduncularis    pbn, parabrachial nuclei","Accessory Olfactory Bulb, Glomerular Layer (Mba)    MBA:188",2nd cerebellar lobule (paxrat)    PAXRAT:4,"Alaminar Spinal Trigeminal Nucleus, Magnocellular Division (Bercat)    BERCAT:5",Dorsal Root Ganglion    UBERON:0000044
Lateral Pes Lemniscus    UBERON:0003010,Pontine Nuclear Group    UBERON:0002151,Vestibular Nuclear Complex    UBERON:0002673,Filum Terminale    UBERON:0005443,Apex Of Lumbar Spinal Cord Dorsal Horn    UBERON:0014632,Caudal Segment Of Spinal Cord    UBERON:0005845,Fourth Cervical Dorsal Root Ganglion    UBERON:0002841,Fourth Thoracic Dorsal Root Ganglion,Fourth Lumbar Dorsal Root Ganglion    UBERON:0003943,Fourth Sacral Dorsal Root Ganglion,Lamina Iv Of Gray Matter Of Spinal Cord    UBERON:0016575,Cervical Spinal Cord Gray Commissure    UBERON:0029626,Thoracic Spinal Cord Gray Commissure    UBERON:0026293,Lumbar Spinal Cord Gray Commissure    UBERON:0033483,Sacral Spinal Cord Lateral Horn    UBERON:0029538,Cocygeal,C3 Segment Of Cervical Spinal Cord    UBERON:0006488,Third Thoracic Spinal Cord Segment    UBERON:0006459,Third Lumbar Spinal Cord Segment    UBERON:0006449,Third Sacral Spinal Cord Segment    UBERON:0006462,Olfactory Nerve    UBERON:0001579,Ankle Nerve    UBERON:0003446,,Linear Nucleus    UBERON:0002557,"Vpr, nucleus sensorius principalis nervi trigemini    null, nucleus lemnisci lateralis","Accessory Olfactory Bulb, Granular Layer (Mba)    MBA:196",3rd and 4th cerebellar lobules (paxrat)    PAXRAT:5,"Alaminar Spinal Trigeminal Nucleus, Parvocellular Division (Bercat)    BERCAT:6",Eighth Cervical Dorsal Root Ganglion    UBERON:0002844
Linear Nucleus    UBERON:0002557,Vestibulocochlear Nerve Root    UBERON:0002731,Medullary Reticular Formation    UBERON:0002559,Funiculus Of Spinal Cord    UBERON:0006127,Apex Of Spinal Cord Dorsal Horn    UBERON:0004678,Central Canal Of Spinal Cord    UBERON:0002291,Fifth Cervical Dorsal Root Ganglion    UBERON:0002842,Fifth Thoracic Dorsal Root Ganglion    UBERON:0002848,,Fifth Sacral Dorsal Root Ganglion    UBERON:0002863,Lamina V Of Gray Matter Of Spinal Cord    UBERON:0016576,Cervical Spinal Cord Lateral Column    UBERON:0005849,Thoracic Spinal Cord Lateral Column    UBERON:0005847,Lumbar Spinal Cord Lateral Column    UBERON:0005850,Sacral Spinal Cord Dorsal Horn    UBERON:0033939,Onuf'S Nucleus,C4 Segment Of Cervical Spinal Cord    UBERON:0006490,Fourth Thoracic Spinal Cord Segment    UBERON:0006452,Fourth Lumbar Spinal Cord Segment    UBERON:0006451,Fourth Sacral Spinal Cord Segment    UBERON:0006463,Terminal Nerve    UBERON:0002924,Ansa Cervicalis    UBERON:0005430,,Dorsal Longitudinal Fasciculus Of Midbrain    UBERON:0003005,"vesn, vestibular nuclei    nucb, nucleus cerebelli","Accessory Olfactory Bulb, Mitral Layer (Mba)    MBA:204",3rd cerebellar lobule (paxrat)    PAXRAT:6,Ammon'S Formation (Bercat)    BERCAT:7,Eighth Thoracic Dorsal Root Ganglion    UBERON:0002851
Dorsal Longitudinal Fasciculus Of Midbrain    UBERON:0003005,Pontine Tegmentum    UBERON:0003023,Root Of Vagus Nerve    UBERON:0011213,Gracile Fasciculus Of Spinal Cord    UBERON:0005826,Apex Of Thoracic Spinal Cord Dorsal Horn    UBERON:0014611,Clarke'S Nucleus    UBERON:0002246,Sixth Cervical Dorsal Root Ganglion    UBERON:0007711,Sixth Thoracic Dorsal Root Ganglion    UBERON:0002849,,,Lamina Viii Of Gray Matter Of Spinal Cord    UBERON:0016579,Cervical Spinal Cord Lateral Horn    UBERON:0014619,Thoracic Spinal Cord Lateral Horn    UBERON:0014607,Lumbar Spinal Cord Lateral Horn    UBERON:0031906,Sacral Spinal Cord Dorsal Column    UBERON:0005840,,C5 Segment Of Cervical Spinal Cord    UBERON:0006491,Fifth Thoracic Spinal Cord Segment    UBERON:0006453,,Fifth Sacral Spinal Cord Segment    UBERON:0006464,Trigeminal Nerve    UBERON:0001645,Anterior Lateral Line Nerve    UBERON:2000425,,Nucleus Of Posterior Commissure    UBERON:0002711,"r2    Vpr, nucleus sensorius principalis nervi trigemini    null, nucleus lemnisci lateralis",Accessory Supraoptic Group (Mba)    MBA:332,3rd ventricle (paxrat)    PAXRAT:7,Anterior Pretectal Nucleus (Bercat)    BERCAT:8,Eleventh Thoracic Dorsal Root Ganglion    UBERON:0002854
Nucleus Of Posterior Commissure    UBERON:0002711,Oral Part Of Spinal Trigeminal Nucleus    UBERON:0002591,White Matter Of Medulla Oblongata    UBERON:0014649,Gray Matter Of Spinal Cord    UBERON:0002315,Caudal Segment Of Spinal Cord    UBERON:0005845,Conus Medullaris    UBERON:0005437,Seventh Cervical Dorsal Root Ganglion    UBERON:0002843,Seventh Thoracic Dorsal Root Ganglion    UBERON:0002850,,,Lamina Ix Of Gray Matter Of Spinal Cord    UBERON:0016580,Cervical Spinal Cord Ventral Column    UBERON:0005854,Thoracic Spinal Cord Ventral Column    UBERON:0005852,Lumbar Spinal Cord Ventral Column    UBERON:0005855,Sacral Spinal Cord Gray Commissure    UBERON:0031111,,C6 Segment Of Cervical Spinal Cord    UBERON:0006492,Sixth Thoracic Spinal Cord Segment    UBERON:0006454,,,Trochlear Nerve    UBERON:0001644,Anterior Superior Alveolar Nerve    UBERON:0035646,,Rostral Interstitial Nucleus Of Medial Longitudinal Fasciculus    UBERON:0002717,"vesn, vestibular nuclei",Accessory Trigeminal Nucleus (Mba)    MBA:549009219,4th and 5th cerebellar lobules (paxrat)    PAXRAT:8,Anteroventral Cochlear Nucleus (Bercat)    BERCAT:9,Fifth Cervical Dorsal Root Ganglion    UBERON:0002842
Rostral Interstitial Nucleus Of Medial Longitudinal Fasciculus    UBERON:0002717,Central Tegmental Tract Of Pons    UBERON:0002783,Cochlear Nuclear Complex    UBERON:0002610,Lamina Of Gray Matter Of Spinal Cord    UBERON:0016570,Central Canal Of Spinal Cord    UBERON:0002291,Cuneate Fasciculus Of Spinal Cord    UBERON:0005832,,Eighth Thoracic Dorsal Root Ganglion    UBERON:0002851,,,Spinal Cord Gray Commisure,Cervical Spinal Cord Ventral Commissure    UBERON:0007836,Thoracic Spinal Cord Ventral Commissure    UBERON:0007837,Lumbar Spinal Cord Ventral Commissure    UBERON:0007834,Sacral Spinal Cord Ventral Column    UBERON:0005853,,C7 Segment Of Cervical Spinal Cord    UBERON:0006493,Seventh Thoracic Spinal Cord Segment    UBERON:0006455,,,Vagus Nerve    UBERON:0001759,Anterodorsal Lateral Line Nerve (Adlln)    UBERON:3010105,,Oculomotor Nuclear Complex    UBERON:0001715,"r3    Vm, nucleus motorius nervi trigemini    pon, pontine nuclei",Agranular Insular Area (Mba)    MBA:95,4th cerebellar lobule (paxrat)    PAXRAT:9,Apical Interpeduncular Nucleus (Bercat)    BERCAT:10,Fifth Lumbar Dorsal Root Ganglion    UBERON:0002859
Oculomotor Nuclear Complex    UBERON:0001715,Intermediate Acoustic Stria    UBERON:0002952,Glossopharyngeal Nerve Root    UBERON:0019310,Meninx Of Spinal Cord    UBERON:0003292,Cervical Spinal Cord Dorsal Column    UBERON:0005841,Dorsal Commissural Nucleus Of Spinal Cord    UBERON:0011776,,Ninth Thoracic Dorsal Root Ganglion    UBERON:0002852,,,,Cervical Spinal Cord White Matter    UBERON:0014614,Thoracic Spinal Cord White Matter    UBERON:0014637,Lumbar Spinal Cord White Matter    UBERON:0026386,Sacral Spinal Cord Ventral Commissure    UBERON:0007835,,,Eighth Thoracic Spinal Cord Segment    UBERON:0006456,,,Vestibulocochlear Nerve    UBERON:0001648,Anteroventral Lateral Line Nerve (Avlln)    UBERON:3010109,,Dorsal Oculomotor Nucleus    UBERON:0002964,"con, cochlear nuclei    null, nucleus lemnisci lateralis","Agranular Insular Area, Dorsal Part (Mba)    MBA:104",4th ventricle (paxrat)    PAXRAT:10,Aqueduct (Bercat)    BERCAT:11,Fifth Sacral Dorsal Root Ganglion    UBERON:0002863
Dorsal Oculomotor Nucleus    UBERON:0002964,Decussation Of Trochlear Nerve    UBERON:0002787,Accessory Xi Nerve Nucleus    UBERON:0020358,Nucleus Of Spinal Cord    UBERON:0011777,Cervical Spinal Cord Dorsal Horn    UBERON:0014620,Dorsomedial Sulcus,,Tenth Thoracic Dorsal Root Ganglion    UBERON:0002853,,,,,,,Sacral Spinal Cord White Matter    UBERON:0026246,,,Ninth Thoracic Spinal Cord Segment    UBERON:0006465,,,Vomeronasal Nerve    UBERON:0009121,Arm Nerve    UBERON:0003433,,Central Oculomotor Nucleus    UBERON:0002960,"Vpr, nucleus sensorius principalis nervi trigemini","Agranular Insular Area, Dorsal Part, Layer 1 (Mba)    MBA:996",5th cerebellar lobule (paxrat)    PAXRAT:11,Area Postrema (Bercat)    BERCAT:12,Fifth Thoracic Dorsal Root Ganglion    UBERON:0002848
Central Oculomotor Nucleus    UBERON:0002960,Vestibulocerebellar Tract    UBERON:0002552,Accessory Cuneate Nucleus    UBERON:0002864,Regional Part Of Spinal Cord    UBERON:0001948,Cervical Spinal Cord Gray Commissure    UBERON:0029626,Fasciculus Of Spinal Cord    UBERON:0005837,,Eleventh Thoracic Dorsal Root Ganglion    UBERON:0002854,,,,,,,Substantia Gelatinosa Of Sacral Spinal Cord Dorsal Horn,,,Tenth Thoracic Spinal Cord Segment    UBERON:0006466,,,Accessory Xi Nerve Cranial Component    UBERON:0009673,Autonomic Nerve    UBERON:0034728,,Medial Oculomotor Nucleus    UBERON:0002975,"con, cochlear nuclei","Agranular Insular Area, Dorsal Part, Layer 2/3 (Mba)    MBA:328",6a cerebellar lobule (paxrat)    PAXRAT:12,"Berman 1968 Cat Label Root,Bercat:",First Cervical Dorsal Root Ganglion    UBERON:0002838
Medial Oculomotor Nucleus    UBERON:0002975,Abducens Nucleus    UBERON:0002682,Accessory Nerve Fiber Bundle    UBERON:0006117,Roof Plate Spinal Cord Region    UBERON:0005724,Cervical Spinal Cord Gray Matter    UBERON:0014613,Filum Terminale Externum    UBERON:0010270,,,,,,,,,,,,Eleventh Thoracic Spinal Cord Segment    UBERON:0006467,,,Accessory Xi Nerve    UBERON:0002019,Axillary Nerve    UBERON:0001493,,Parvocellular Oculomotor Nucleus    UBERON:0002141,"r4    VIIm, nucleus motorius nervi facialis","Agranular Insular Area, Dorsal Part, Layer 5 (Mba)    MBA:1101",6b cerebellar lobule (paxrat)    PAXRAT:13,"Brachium Con, Cochlear Nucleijunctivum (Bercat)    BERCAT:13",First Lumbar Dorsal Root Ganglion    UBERON:0002857
Parvocellular Oculomotor Nucleus    UBERON:0002141,Trapezoid Body    UBERON:0002932,Anterior Spinocerebellar Tract    UBERON:0002987,Spinal Cord Column    UBERON:0016550,Cervical Spinal Cord Lateral Column    UBERON:0005849,Filum Terminale Internum    UBERON:0010269,,,,,,,,,,,,,,,Anterior Lateral Line Nerve    UBERON:2000425,Back Nerve    UBERON:0004215,,Ventral Oculomotor Nucleus    UBERON:0002934,"r5    VI, nucleus nervi abducentis    olsl, oliva superior","Agranular Insular Area, Dorsal Part, Layer 6A (Mba)    MBA:783",6c cerebellar lobule (paxrat)    PAXRAT:14,Brachium Of The Inferior Colliculus (Bercat)    BERCAT:14,First Sacral Dorsal Root Ganglion    UBERON:0002860
Ventral Oculomotor Nucleus    UBERON:0002934,Medial Parabrachial Nucleus    UBERON:0002918,Anteroventral Cochlear Nucleus    UBERON:0002830,Spinal Cord Ependyma    UBERON:0005359,Cervical Spinal Cord Lateral Horn    UBERON:0014619,Filum Terminale    UBERON:0005443,,,,,,,,,,,,,,,Anterodorsal Lateral Line Nerve (Adlln)    UBERON:3010105,Buccal Nerve    UBERON:0013646,,Caudal Central Oculomotor Nucleus    UBERON:0002957,"Vpr, nucleus sensorius principalis nervi trigemini    olsm, oliva superior, medial nucleus","Agranular Insular Area, Dorsal Part, Layer 6B (Mba)    MBA:831",6th cerebellar lobule (paxrat)    PAXRAT:15,Brachium Pontis (Bercat)    BERCAT:15,First Thoracic Dorsal Root Ganglion    UBERON:0002845
Caudal Central Oculomotor Nucleus    UBERON:0002957,Spinothalamic Tract Of Pons    UBERON:0002798,Area Postrema    UBERON:0002162,Spinal Cord Lateral Horn    UBERON:0004676,Cervical Spinal Cord Ventral Column    UBERON:0005854,Floor Plate Spinal Cord Region    UBERON:0005723,,,,,,,,,,,,,,,Anteroventral Lateral Line Nerve (Avlln)    UBERON:3010109,Carotid Sinus Nerve    UBERON:0009009,,Anterior Median Oculomotor Nucleus    UBERON:0002701,"r6    VI, nucleus nervi abducentis    olsm, oliva superior, medial nucleus","Agranular Insular Area, Posterior Part (Mba)    MBA:111",7th cerebellar lobule (paxrat)    PAXRAT:16,Central Canal (Bercat)    BERCAT:16,Forth Lumbar Dorsal Root Ganglion
Anterior Median Oculomotor Nucleus    UBERON:0002701,Motor Root Of Trigeminal Nerve    UBERON:0002796,Caudal Part Of Spinal Trigeminal Nucleus    UBERON:0002866,Spinal Cord Lateral Wall    UBERON:0009582,Cervical Spinal Cord Ventral Commissure    UBERON:0007836,Funiculus Of Spinal Cord    UBERON:0006127,,,,,,,,,,,,,,,Chorda Tympani Branch Of Facial Nerve    UBERON:0009675,Chest Nerve    UBERON:0003432,,Intermediate Oculomotor Nucleus    UBERON:0002970,"r7    IX(m), nucleus motorius nervi glossopharyngei","Agranular Insular Area, Posterior Part, Layer 1 (Mba)    MBA:120",8th cerebellar lobule (paxrat)    PAXRAT:17,Central Interpeduncular Nucleus (Bercat)    BERCAT:17,Fourth Sacral Dorsal Root Ganglion
Intermediate Oculomotor Nucleus    UBERON:0002970,Dorsal Trigeminal Tract    UBERON:0002797,Central Gray Substance Of Medulla    UBERON:0002867,Spinal Cord    UBERON:0002240,Cervical Spinal Cord Ventral Horn    UBERON:0014621,Ganglion Part Of Peripheral Nervous System    UBERON:0024940,,,,,,,,,,,,,,,Cranial Nerve    UBERON:0001785,Cholinergic Enteric Nerve    UBERON:0010406,,Dentatothalamic Tract    UBERON:0002594,"nufs, nucleus fasciculi solitarii","Agranular Insular Area, Posterior Part, Layer 2/3 (Mba)    MBA:163",9th cerebellar lobule (paxrat)    PAXRAT:18,Central Linear Nucleus (Bercat)    BERCAT:18,Fourth Cervical Dorsal Root Ganglion    UBERON:0002841
Dentatothalamic Tract    UBERON:0002594,Dorsal Longitudinal Fasciculus Of Pons    UBERON:0002793,Central Medullary Reticular Nuclear Complex    UBERON:0035940,Subdivision Of Spinal Cord Central Canal    UBERON:0014538,Cervical Spinal Cord White Matter    UBERON:0014614,Gracile Fasciculus Of Spinal Cord    UBERON:0005826,,,,,,,,,,,,,,,Dorsal Anterior Lateral Line Nerve    UBERON:2001480,Chorda Tympani Branch Of Facial Nerve    UBERON:0009675,,Interstitial Nucleus Of Cajal    UBERON:0002551,"nurdV, nucleus of the radix descendens of V","Agranular Insular Area, Posterior Part, Layer 5 (Mba)    MBA:344",9th cerebellar lobule a (paxrat)    PAXRAT:19,Central Nucleus Of The Inferior Colliculus (Bercat)    BERCAT:19,Fourth Thoracic Dorsal Root Ganglion
Interstitial Nucleus Of Cajal    UBERON:0002551,Nucleus Subceruleus    UBERON:0002587,Cochlear Nucleus    UBERON:0001720,Tract Of Spinal Cord    UBERON:0007699,Cervical Spinal Cord    UBERON:0002726,Intermediolateral Nucleus    UBERON:0002175,,,,,,,,,,,,,,,Jugal Ramule    UBERON:3010778,Coccygeal Nerve    UBERON:0009629,,Midbrain Reticular Formation    UBERON:0002639,"r8    XII    oli, oliva inferior","Agranular Insular Area, Posterior Part, Layer 6A (Mba)    MBA:314",9th cerebellar lobule a and b (paxrat)    PAXRAT:20,Central Tegmental Field (Bercat)    BERCAT:20,Ganglion Part Of Peripheral Nervous System    UBERON:0024940
Midbrain Reticular Formation    UBERON:0002639,Lateral Parabrachial Nucleus    UBERON:0003007,Commissural Nucleus Of Vagus Nerve    UBERON:0002868,Urophysis    UBERON:0011359,Cervical Subsegment Of Spinal Cord    UBERON:0007714,Intermediomedial Cell Column,,,,,,,,,,,,,,,Lateral Line Nerve    UBERON:0008906,Cochlear Nerve    UBERON:0004727,,Pedunculopontine Tegmental Nucleus    UBERON:0002142,"X(m), nucleus motorius nervi vagi","Agranular Insular Area, Posterior Part, Layer 6B (Mba)    MBA:355",9th cerebellar lobule b (paxrat)    PAXRAT:21,Cerebellar Cortex (Bercat)    BERCAT:21,Grueneberg Ganglion    UBERON:0013208
Pedunculopontine Tegmental Nucleus    UBERON:0002142,Dorsal Nucleus Of Lateral Lemniscus    UBERON:0003006,Cuneate Fasciculus Of Medulla    UBERON:0002642,White Matter Of Spinal Cord    UBERON:0002318,Conus Medullaris    UBERON:0005437,Lamina Of Gray Matter Of Spinal Cord    UBERON:0016570,,,,,,,,,,,,,,,Middle Lateral Line Nerve (Mlln)    UBERON:3010126,Common Fibular Nerve    UBERON:0001324,,Subcuneiform Nucleus    UBERON:0002700,"r9    XII    nufl, nucleus funiculi lateralis","Agranular Insular Area, Ventral Part (Mba)    MBA:119",9th cerebellar lobule c (paxrat)    PAXRAT:22,Cerebral Cortex (Bercat)    BERCAT:22,Inferior Part Of Vestibular Ganglion    UBERON:0002826
Subcuneiform Nucleus    UBERON:0002700,Medial Longitudinal Fasciculus Of Pons    UBERON:0002794,Cuneate Nucleus    UBERON:0002045,,Cuneate Fasciculus Of Spinal Cord    UBERON:0005835,Lateral Cervical Nucleus    FMA:73921,,,,,,,,,,,,,,,Middle Lateral Line Nerve    UBERON:2001482,Communicating Branch Of Spinal Nerve    UBERON:0017642,,Cuneiform Nucleus    UBERON:0002696,"X(m), nucleus motorius nervi vagi    oli, oliva inferior","Agranular Insular Area, Ventral Part, Layer 1 (Mba)    MBA:704",A1 noradrenaline cells (paxrat)    PAXRAT:24,Choroid Plexus (Bercat)    BERCAT:23,Lumbar Dorsal Root Ganglion    UBERON:0002836
Cuneiform Nucleus    UBERON:0002696,Tectopontine Tract    UBERON:0002930,Cuneocerebellar Tract    UBERON:0002640,,Dorsal Commissural Nucleus Of Spinal Cord    UBERON:0011776,Lateral Corticospinal Tract    FMA:72635,,,,,,,,,,,,,,,Oral Ramule    UBERON:3010794,Cranial Nerve    UBERON:0001785,,Central Tegmental Tract Of Midbrain    UBERON:0002585,"r10    XII    nuce, nucleus cuneatus externus","Agranular Insular Area, Ventral Part, Layer 2/3 (Mba)    MBA:694",A1 noradrenaline cells/C1 adrenaline cells (paxrat)    PAXRAT:25,Cochlear Granular Layer (Bercat)    BERCAT:24,Ninth Thoracic Dorsal Root Ganglion    UBERON:0002852
Central Tegmental Tract Of Midbrain    UBERON:0002585,Principal Sensory Nucleus Of Trigeminal Nerve    UBERON:0002597,Decussation Of Medial Lemniscus    UBERON:0002643,,Dorsal Gray Commissure Of Spinal Cord    UBERON:0014631,Lateral Spinal Nucleus    UBERON:0035024,,,,,,,,,,,,,,,Posterior Lateral Line Nerve (Plln)    UBERON:3010115,Deep Fibular Nerve    UBERON:0035207,,Midbrain Raphe Nuclei    UBERON:0007412,"X(m), nucleus motorius nervi vagi    nufl, nucleus funiculi lateralis","Agranular Insular Area, Ventral Part, Layer 5 (Mba)    MBA:800",A11 dopamine cells (paxrat)    PAXRAT:31,Cochlear Nerve (Bercat)    BERCAT:25,Parasympathetic Ganglion    UBERON:0001808
Midbrain Raphe Nuclei    UBERON:0007412,Medial Lemniscus Of Pons    UBERON:0002958,Dorsal Cap Of Kooy    UBERON:0014286,,Dorsal Horn Of Spinal Cord    UBERON:0002256,Meninx Of Spinal Cord    UBERON:0003292,,,,,,,,,,,,,,,Posterior Lateral Line Nerve    UBERON:2000175,Deep Temporal Nerve    UBERON:0011327,,Pallidotegmental Fasciculus    UBERON:0002671,"nufs, nucleus fasciculi solitarii    oli, oliva inferior","Agranular Insular Area, Ventral Part, Layer 6A (Mba)    MBA:675",A13 dopamine cells (paxrat)    PAXRAT:32,Commissure Of The Fornix (Bercat)    BERCAT:26,Regional Part Of Vestibular Ganglion
