,,,,,,,,,,,,,,,,,,,,,,,,,"Paraventricular Hypothalamic Nucleus, Descending Division, Medial Parvicellular Part, Ventral Zone (Mba)    MBA:464",olfactory tubercle densocellular layer (paxrat)    PAXRAT:664
,,,,,,,,,,,,,,,,,,,,,,,,,"Paraventricular Hypothalamic Nucleus, Magnocellular Division (Mba)    MBA:71",olfactory tubercle plexiform layer (paxrat)    PAXRAT:665
,,,,,,,,,,,,,,,,,,,,,,,,,"Paraventricular Hypothalamic Nucleus, Magnocellular Division, Anterior Magnocellular Part (Mba)    MBA:47",olfactory tubercle polymorph layer (paxrat)    PAXRAT:666
,,,,,,,,,,,,,,,,,,,,,,,,,"Paraventricular Hypothalamic Nucleus, Magnocellular Division, Medial Magnocellular Part (Mba)    MBA:79",olfactory ventricle (olfactory part of lateral ventricle) (paxrat)    PAXRAT:667
,,,,,,,,,,,,,,,,,,,,,,,,,"Paraventricular Hypothalamic Nucleus, Magnocellular Division, Posterior Magnocellular Part (Mba)    MBA:103",olivary pretectal nucleus (paxrat)    PAXRAT:668
,,,,,,,,,,,,,,,,,,,,,,,,,"Paraventricular Hypothalamic Nucleus, Magnocellular Division, Posterior Magnocellular Part, Lateral Zone (Mba)    MBA:652",olivocerebellar tract (paxrat)    PAXRAT:669
,,,,,,,,,,,,,,,,,,,,,,,,,"Paraventricular Hypothalamic Nucleus, Magnocellular Division, Posterior Magnocellular Part, Medial Zone (Mba)    MBA:660",olivocochlear bundle (paxrat)    PAXRAT:670
,,,,,,,,,,,,,,,,,,,,,,,,,"Paraventricular Hypothalamic Nucleus, Parvicellular Division (Mba)    MBA:94",optic chiasm (paxrat)    PAXRAT:671
,,,,,,,,,,,,,,,,,,,,,,,,,"Paraventricular Hypothalamic Nucleus, Parvicellular Division, Anterior Parvicellular Part (Mba)    MBA:55",optic nerve (paxrat)    PAXRAT:672
,,,,,,,,,,,,,,,,,,,,,,,,,"Paraventricular Hypothalamic Nucleus, Parvicellular Division, Medial Parvicellular Part, Dorsal Zone (Mba)    MBA:87",optic nerve layer of the superior colliculus (paxrat)    PAXRAT:673
,,,,,,,,,,,,,,,,,,,,,,,,,"Paraventricular Hypothalamic Nucleus, Parvicellular Division, Periventricular Part (Mba)    MBA:110",optic tract (paxrat)    PAXRAT:674
,,,,,,,,,,,,,,,,,,,,,,,,,Paraventricular Nucleus Of The Thalamus (Mba)    MBA:149,oriens layer of the hippocampus (paxrat)    PAXRAT:675
,,,,,,,,,,,,,,,,,,,,,,,,,Parvicellular Motor 5 Nucleus (Mba)    MBA:549009223,outer blade of the dentate gyrus (paxrat)    PAXRAT:676
,,,,,,,,,,,,,,,,,,,,,,,,,Parvicellular Reticular Nucleus (Mba)    MBA:852,oval paracentral thalamic nucleus (paxrat)    PAXRAT:677
,,,,,,,,,,,,,,,,,,,,,,,,,Pedunculopontine Nucleus (Mba)    MBA:1052,p1 periaqueductal gray (paxrat)    PAXRAT:678
,,,,,,,,,,,,,,,,,,,,,,,,,Periaqueductal Gray (Mba)    MBA:795,paraabducens nucleus (paxrat)    PAXRAT:679
,,,,,,,,,,,,,,,,,,,,,,,,,Perifornical Nucleus (Mba)    MBA:576073704,parabigeminal nucleus (paxrat)    PAXRAT:680
,,,,,,,,,,,,,,,,,,,,,,,,,Perihypoglossal Nuclei (Mba)    MBA:154,parabrachial nucleus (paxrat)    PAXRAT:681
,,,,,,,,,,,,,,,,,,,,,,,,,Peripeduncular Nucleus (Mba)    MBA:1044,parabrachial nucleus-waist part (paxrat)    PAXRAT:682
,,,,,,,,,,,,,,,,,,,,,,,,,Perireunensis Nucleus (Mba)    MBA:1077,parabrachial pigmented nucleus of the VTA (paxrat)    PAXRAT:683
,,,,,,,,,,,,,,,,,,,,,,,,,Perirhinal Area (Mba)    MBA:922,paracentral thalamic nucleus (paxrat)    PAXRAT:684
,,,,,,,,,,,,,,,,,,,,,,,,,"Perirhinal Area, Layer 1 (Mba)    MBA:540",paracochlear glial substance (paxrat)    PAXRAT:685
,,,,,,,,,,,,,,,,,,,,,,,,,"Perirhinal Area, Layer 2/3 (Mba)    MBA:888",paracollicular tegmentum (paxrat)    PAXRAT:686
,,,,,,,,,,,,,,,,,,,,,,,,,"Perirhinal Area, Layer 5 (Mba)    MBA:692",paracommissural nucleus of the posterior commissure (paxrat)    PAXRAT:687
,,,,,,,,,,,,,,,,,,,,,,,,,"Perirhinal Area, Layer 6A (Mba)    MBA:335",parafascicular thalamic nucleus (paxrat)    PAXRAT:688
,,,,,,,,,,,,,,,,,,,,,,,,,"Perirhinal Area, Layer 6B (Mba)    MBA:368",parafloccular sulcus (paxrat)    PAXRAT:689
,,,,,,,,,,,,,,,,,,,,,,,,,Peritrigeminal Zone (Mba)    MBA:549009215,paraflocculus (paxrat)    PAXRAT:690
,,,,,,,,,,,,,,,,,,,,,,,,,"Periventricular Hypothalamic Nucleus, Anterior Part (Mba)    MBA:30",parainterfascicular nucleus of the VTA (paxrat)    PAXRAT:691
,,,,,,,,,,,,,,,,,,,,,,,,,"Periventricular Hypothalamic Nucleus, Intermediate Part (Mba)    MBA:118",paralambdoid septal nucleus (paxrat)    PAXRAT:692
,,,,,,,,,,,,,,,,,,,,,,,,,"Periventricular Hypothalamic Nucleus, Posterior Part (Mba)    MBA:126",paralemniscal nucleus (paxrat)    PAXRAT:693
,,,,,,,,,,,,,,,,,,,,,,,,,"Periventricular Hypothalamic Nucleus, Preoptic Part (Mba)    MBA:133",paramedian lobule (paxrat)    PAXRAT:694
,,,,,,,,,,,,,,,,,,,,,,,,,Periventricular Region (Mba)    MBA:141,paramedian raphe nucleus (paxrat)    PAXRAT:695
,,,,,,,,,,,,,,,,,,,,,,,,,Periventricular Zone (Mba)    MBA:157,paramedian reticular nucleus (paxrat)    PAXRAT:696
,,,,,,,,,,,,,,,,,,,,,,,,,Pineal Body (Mba)    MBA:953,paramedian sulcus (paxrat)    PAXRAT:697
,,,,,,,,,,,,,,,,,,,,,,,,,Piriform Area (Mba)    MBA:961,paranigral nucleus of the VTA (paxrat)    PAXRAT:698
,,,,,,,,,,,,,,,,,,,,,,,,,"Piriform Area, Layers 1-3 (Mba)    MBA:152",parapyramidal nucleus (paxrat)    PAXRAT:699
,,,,,,,,,,,,,,,,,,,,,,,,,"Piriform Area, Molecular Layer (Mba)    MBA:276",pararubral nucleus (paxrat)    PAXRAT:700
,,,,,,,,,,,,,,,,,,,,,,,,,"Piriform Area, Polymorph Layer (Mba)    MBA:291",parasolitary nucleus (paxrat)    PAXRAT:701
,,,,,,,,,,,,,,,,,,,,,,,,,"Piriform Area, Pyramidal Layer (Mba)    MBA:284",parastrial nucleus (paxrat)    PAXRAT:702
,,,,,,,,,,,,,,,,,,,,,,,,,Piriform-Amygdalar Area (Mba)    MBA:788,parasubiculum (paxrat)    PAXRAT:703
,,,,,,,,,,,,,,,,,,,,,,,,,"Piriform-Amygdalar Area, Layers 1-3 (Mba)    MBA:400",parasubthalamic nucleus (paxrat)    PAXRAT:704
,,,,,,,,,,,,,,,,,,,,,,,,,"Piriform-Amygdalar Area, Molecular Layer (Mba)    MBA:408",paratenial thalamic nucleus (paxrat)    PAXRAT:705
,,,,,,,,,,,,,,,,,,,,,,,,,"Piriform-Amygdalar Area, Polymorph Layer (Mba)    MBA:424",paraterete nucleus (paxrat)    PAXRAT:706
,,,,,,,,,,,,,,,,,,,,,,,,,"Piriform-Amygdalar Area, Pyramidal Layer (Mba)    MBA:416",paratrigeminal nucleus (paxrat)    PAXRAT:707
,,,,,,,,,,,,,,,,,,,,,,,,,Pons (Mba)    MBA:771,paratrochlear nucleus (paxrat)    PAXRAT:708
,,,,,,,,,,,,,,,,,,,,,,,,,"Pons, Behavioral State Related (Mba)    MBA:1117",paraventricular hypoth nucleus (paxrat)    PAXRAT:709
,,,,,,,,,,,,,,,,,,,,,,,,,"Pons, Motor Related (Mba)    MBA:987",paraventricular hypothalamic nucleus-anterior magnocellular part (paxrat)    PAXRAT:710
,,,,,,,,,,,,,,,,,,,,,,,,,"Pons, Sensory Related (Mba)    MBA:1132",paraventricular hypothalamic nucleus-anterior parvicellular part (paxrat)    PAXRAT:711
,,,,,,,,,,,,,,,,,,,,,,,,,Pontine Central Gray (Mba)    MBA:898,paraventricular hypothalamic nucleus-dorsal cap (paxrat)    PAXRAT:712
,,,,,,,,,,,,,,,,,,,,,,,,,Pontine Gray (Mba)    MBA:931,paraventricular hypothalamic nucleus-lateral magnocellular part (paxrat)    PAXRAT:713
,,,,,,,,,,,,,,,,,,,,,,,,,Pontine Reticular Nucleus (Mba)    MBA:146,paraventricular hypothalamic nucleus-medial magnocellular part (paxrat)    PAXRAT:714
,,,,,,,,,,,,,,,,,,,,,,,,,"Pontine Reticular Nucleus, Caudal Part (Mba)    MBA:1093",paraventricular hypothalamic nucleus-medial parvicellular part (paxrat)    PAXRAT:715
,,,,,,,,,,,,,,,,,,,,,,,,,"Pontine Reticular Nucleus, Ventral Part (Mba)    MBA:552",paraventricular hypothalamic nucleus-posterior part (paxrat)    PAXRAT:716
,,,,,,,,,,,,,,,,,,,,,,,,,Posterior Amygdalar Nucleus (Mba)    MBA:780,paraventricular hypothalamic nucleus-ventral part (paxrat)    PAXRAT:717
,,,,,,,,,,,,,,,,,,,,,,,,,Posterior Auditory Area (Mba)    MBA:1027,paraventricular thalamic nucleus (paxrat)    PAXRAT:718
,,,,,,,,,,,,,,,,,,,,,,,,,"Posterior Auditory Area, Layer 1 (Mba)    MBA:696",paraventricular thalamic nucleus-anterior part (paxrat)    PAXRAT:719
,,,,,,,,,,,,,,,,,,,,,,,,,"Posterior Auditory Area, Layer 2/3 (Mba)    MBA:643",paraventricular thalamic nucleus-posterior part (paxrat)    PAXRAT:720
,,,,,,,,,,,,,,,,,,,,,,,,,"Posterior Auditory Area, Layer 4 (Mba)    MBA:759",paraxiphoid nucleus of thalamus (paxrat)    PAXRAT:721
,,,,,,,,,,,,,,,,,,,,,,,,,"Posterior Auditory Area, Layer 5 (Mba)    MBA:791",parietal association cortex (paxrat)    PAXRAT:722
,,,,,,,,,,,,,,,,,,,,,,,,,"Posterior Auditory Area, Layer 6A (Mba)    MBA:249",parietal cortex-posterior area-caudal part (paxrat)    PAXRAT:723
,,,,,,,,,,,,,,,,,,,,,,,,,"Posterior Auditory Area, Layer 6B (Mba)    MBA:456",parietal cortex-posterior area-dorsal part (paxrat)    PAXRAT:724
,,,,,,,,,,,,,,,,,,,,,,,,,Posterior Complex Of The Thalamus (Mba)    MBA:1020,parietal cortex-posterior area-rostral part (paxrat)    PAXRAT:725
,,,,,,,,,,,,,,,,,,,,,,,,,Posterior Hypothalamic Nucleus (Mba)    MBA:946,parvicellular motor trigeminal nucleus (paxrat)    PAXRAT:726
,,,,,,,,,,,,,,,,,,,,,,,,,Posterior Intralaminar Thalamic Nucleus (Mba)    MBA:560581563,parvicellular reticular nucleus (paxrat)    PAXRAT:727
,,,,,,,,,,,,,,,,,,,,,,,,,Posterior Limiting Nucleus Of The Thalamus (Mba)    MBA:1029,parvicellular reticular nucleus-alpha part (paxrat)    PAXRAT:728
,,,,,,,,,,,,,,,,,,,,,,,,,Posterior Parietal Association Areas (Mba)    MBA:22,peduncular part of lateral hypothalamus (paxrat)    PAXRAT:729
,,,,,,,,,,,,,,,,,,,,,,,,,"Posterior Parietal Association Areas, Layer 1 (Mba)    MBA:532",pedunculopontine tegmental nucleus (paxrat)    PAXRAT:730
,,,,,,,,,,,,,,,,,,,,,,,,,"Posterior Parietal Association Areas, Layer 2/3 (Mba)    MBA:241",periaqueductal gray (paxrat)    PAXRAT:731
,,,,,,,,,,,,,,,,,,,,,,,,,"Posterior Parietal Association Areas, Layer 4 (Mba)    MBA:635",perifacial zone (paxrat)    PAXRAT:732
,,,,,,,,,,,,,,,,,,,,,,,,,"Posterior Parietal Association Areas, Layer 5 (Mba)    MBA:683",perifornical nucleus (paxrat)    PAXRAT:733
,,,,,,,,,,,,,,,,,,,,,,,,,"Posterior Parietal Association Areas, Layer 6A (Mba)    MBA:308",perifornical part of lateral hypothalamus (paxrat)    PAXRAT:734
,,,,,,,,,,,,,,,,,,,,,,,,,"Posterior Parietal Association Areas, Layer 6B (Mba)    MBA:340",perilemniscal nucleus-ventral part (paxrat)    PAXRAT:735
,,,,,,,,,,,,,,,,,,,,,,,,,Posterior Pretectal Nucleus (Mba)    MBA:1061,periolivary horn (paxrat)    PAXRAT:736
,,,,,,,,,,,,,,,,,,,,,,,,,Posterior Triangular Thalamic Nucleus (Mba)    MBA:563807435,peripeduncular nucleus (paxrat)    PAXRAT:737
,,,,,,,,,,,,,,,,,,,,,,,,,Posterodorsal Preoptic Nucleus (Mba)    MBA:914,perirhinal cortex (paxrat)    PAXRAT:738
,,,,,,,,,,,,,,,,,,,,,,,,,Posterodorsal Tegmental Nucleus (Mba)    MBA:599626927,peritrigeminal zone (paxrat)    PAXRAT:739
,,,,,,,,,,,,,,,,,,,,,,,,,Posterolateral Visual Area (Mba)    MBA:425,periventricular fiber system (paxrat)    PAXRAT:740
,,,,,,,,,,,,,,,,,,,,,,,,,"Posterolateral Visual Area, Layer 1 (Mba)    MBA:750",periventricular gray (paxrat)    PAXRAT:741
,,,,,,,,,,,,,,,,,,,,,,,,,"Posterolateral Visual Area, Layer 2/3 (Mba)    MBA:269",periventricular hypothalamic nucleus (paxrat)    PAXRAT:742
,,,,,,,,,,,,,,,,,,,,,,,,,"Posterolateral Visual Area, Layer 4 (Mba)    MBA:869",periventricular hypothalamic nucleus-anterior parvicellular part (paxrat)    PAXRAT:743
,,,,,,,,,,,,,,,,,,,,,,,,,"Posterolateral Visual Area, Layer 5 (Mba)    MBA:902",pineal gland (paxrat)    PAXRAT:744
,,,,,,,,,,,,,,,,,,,,,,,,,"Posterolateral Visual Area, Layer 6A (Mba)    MBA:377",pineal recess (paxrat)    PAXRAT:745
,,,,,,,,,,,,,,,,,,,,,,,,,"Posterolateral Visual Area, Layer 6B (Mba)    MBA:393",pineal stalk (paxrat)    PAXRAT:746
,,,,,,,,,,,,,,,,,,,,,,,,,Postpiriform Transition Area (Mba)    MBA:566,piriform cortex (paxrat)    PAXRAT:747
,,,,,,,,,,,,,,,,,,,,,,,,,"Postpiriform Transition Area, Layers 1 (Mba)    MBA:1140",piriform cortex-layer 1 (paxrat)    PAXRAT:748
,,,,,,,,,,,,,,,,,,,,,,,,,"Postpiriform Transition Area, Layers 1-3 (Mba)    MBA:517",pleomorphic part of periaqueductai gray (paxrat)    PAXRAT:749
,,,,,,,,,,,,,,,,,,,,,,,,,"Postpiriform Transition Area, Layers 2 (Mba)    MBA:1141",polymorph layer of the dentate gyrus (paxrat)    PAXRAT:750
,,,,,,,,,,,,,,,,,,,,,,,,,"Postpiriform Transition Area, Layers 3 (Mba)    MBA:1142",pontine nuclei (paxrat)    PAXRAT:751
,,,,,,,,,,,,,,,,,,,,,,,,,Postrhinal Area (Mba)    MBA:312782628,pontine raphe nucleus (paxrat)    PAXRAT:752
,,,,,,,,,,,,,,,,,,,,,,,,,"Postrhinal Area, Layer 1 (Mba)    MBA:312782632",pontine reticular nucleus-caudal part (paxrat)    PAXRAT:753
,,,,,,,,,,,,,,,,,,,,,,,,,"Postrhinal Area, Layer 2/3 (Mba)    MBA:312782636",pontine reticular nucleus-oral part (paxrat)    PAXRAT:754
,,,,,,,,,,,,,,,,,,,,,,,,,"Postrhinal Area, Layer 4 (Mba)    MBA:312782640",pontine reticular nucleus-ventral part (paxrat)    PAXRAT:755
,,,,,,,,,,,,,,,,,,,,,,,,,"Postrhinal Area, Layer 5 (Mba)    MBA:312782644",posterior cerebral artery (paxrat)    PAXRAT:756
,,,,,,,,,,,,,,,,,,,,,,,,,"Postrhinal Area, Layer 6A (Mba)    MBA:312782648",posterior commissure (paxrat)    PAXRAT:757
,,,,,,,,,,,,,,,,,,,,,,,,,"Postrhinal Area, Layer 6B (Mba)    MBA:312782652",posterior hypothalamic area (paxrat)    PAXRAT:758
,,,,,,,,,,,,,,,,,,,,,,,,,Postsubiculum (Mba)    MBA:1037,posterior hypothalamic area-dorsal part (paxrat)    PAXRAT:759
,,,,,,,,,,,,,,,,,,,,,,,,,"Postsubiculum, Layer 1 (Mba)    MBA:10696",posterior hypothalamic nucleus (paxrat)    PAXRAT:760
,,,,,,,,,,,,,,,,,,,,,,,,,"Postsubiculum, Layer 2 (Mba)    MBA:10697",posterior intralaminar thalamic nucleus (paxrat)    PAXRAT:761
,,,,,,,,,,,,,,,,,,,,,,,,,"Postsubiculum, Layer 3 (Mba)    MBA:10698",posterior limitans thalamic nucleus (paxrat)    PAXRAT:762
,,,,,,,,,,,,,,,,,,,,,,,,,Precommissural Nucleus (Mba)    MBA:50,posterior lobe of pituitary (paxrat)    PAXRAT:763
,,,,,,,,,,,,,,,,,,,,,,,,,Prelimbic Area (Mba)    MBA:972,posterior pretectal nucleus (paxrat)    PAXRAT:764
,,,,,,,,,,,,,,,,,,,,,,,,,"Prelimbic Area, Layer 1 (Mba)    MBA:171",posterior superior fissure (paxrat)    PAXRAT:765
,,,,,,,,,,,,,,,,,,,,,,,,,"Prelimbic Area, Layer 2 (Mba)    MBA:195",posterior thalamic nuclear group (paxrat)    PAXRAT:766
,,,,,,,,,,,,,,,,,,,,,,,,,"Prelimbic Area, Layer 2/3 (Mba)    MBA:304",posterior thalamic nuclear group-triangular part (paxrat)    PAXRAT:767
,,,,,,,,,,,,,,,,,,,,,,,,,"Prelimbic Area, Layer 5 (Mba)    MBA:363",posterodorsal preoptic nucleus (paxrat)    PAXRAT:768
,,,,,,,,,,,,,,,,,,,,,,,,,"Prelimbic Area, Layer 6A (Mba)    MBA:84",posterodorsal raphe nucleus (paxrat)    PAXRAT:769
,,,,,,,,,,,,,,,,,,,,,,,,,"Prelimbic Area, Layer 6B (Mba)    MBA:132",posterodorsal tegmental nucleus (paxrat)    PAXRAT:770
,,,,,,,,,,,,,,,,,,,,,,,,,Preparasubthalamic Nucleus (Mba)    MBA:356,posterolateral cortical amygdaloid nucleus (paxrat)    PAXRAT:771
,,,,,,,,,,,,,,,,,,,,,,,,,Presubiculum (Mba)    MBA:1084,posterolateral fissure (paxrat)    PAXRAT:772
,,,,,,,,,,,,,,,,,,,,,,,,,"Presubiculum, Layer 1 (Mba)    MBA:10699",posteromedial cortical amygdaloid nucleus (paxrat)    PAXRAT:773
,,,,,,,,,,,,,,,,,,,,,,,,,"Presubiculum, Layer 2 (Mba)    MBA:10700",posteromedian thalamic nucleus (paxrat)    PAXRAT:774
,,,,,,,,,,,,,,,,,,,,,,,,,"Presubiculum, Layer 3 (Mba)    MBA:10701",postsubiculum (paxrat)    PAXRAT:775
,,,,,,,,,,,,,,,,,,,,,,,,,Pretectal Region (Mba)    MBA:1100,pre-Botzinger complex (paxrat)    PAXRAT:776
,,,,,,,,,,,,,,,,,,,,,,,,,Primary Auditory Area (Mba)    MBA:1002,pre-Edinger-Westphal nucleus (paxrat)    PAXRAT:777
,,,,,,,,,,,,,,,,,,,,,,,,,"Primary Auditory Area, Layer 1 (Mba)    MBA:735",precommissural fornix (paxrat)    PAXRAT:778
,,,,,,,,,,,,,,,,,,,,,,,,,"Primary Auditory Area, Layer 2/3 (Mba)    MBA:251",precommissural nucleus (paxrat)    PAXRAT:779
,,,,,,,,,,,,,,,,,,,,,,,,,"Primary Auditory Area, Layer 4 (Mba)    MBA:816",preculminate fissure (paxrat)    PAXRAT:780
,,,,,,,,,,,,,,,,,,,,,,,,,"Primary Auditory Area, Layer 5 (Mba)    MBA:847",precuneiform area (paxrat)    PAXRAT:781
,,,,,,,,,,,,,,,,,,,,,,,,,"Primary Auditory Area, Layer 6A (Mba)    MBA:954",predorsal bundle (paxrat)    PAXRAT:782
,,,,,,,,,,,,,,,,,,,,,,,,,"Primary Auditory Area, Layer 6B (Mba)    MBA:1005",prelimbic cortex (paxrat)    PAXRAT:783
,,,,,,,,,,,,,,,,,,,,,,,,,Primary Motor Area (Mba)    MBA:985,premammillary nucleus-dorsal part (paxrat)    PAXRAT:784
,,,,,,,,,,,,,,,,,,,,,,,,,"Primary Motor Area, Layer 1 (Mba)    MBA:320",premammillary nucleus-ventral part (paxrat)    PAXRAT:785
,,,,,,,,,,,,,,,,,,,,,,,,,"Primary Motor Area, Layer 2/3 (Mba)    MBA:943",preoptic recess of the 3rd ventricle (paxrat)    PAXRAT:786
,,,,,,,,,,,,,,,,,,,,,,,,,"Primary Motor Area, Layer 5 (Mba)    MBA:648",prepositus nucleus (paxrat)    PAXRAT:787
,,,,,,,,,,,,,,,,,,,,,,,,,"Primary Motor Area, Layer 6A (Mba)    MBA:844",prepyramidal fissure (paxrat)    PAXRAT:788
,,,,,,,,,,,,,,,,,,,,,,,,,"Primary Motor Area, Layer 6B (Mba)    MBA:882",prerubral field (paxrat)    PAXRAT:789
,,,,,,,,,,,,,,,,,,,,,,,,,Primary Somatosensory Area (Mba)    MBA:322,presubiculum (paxrat)    PAXRAT:790
,,,,,,,,,,,,,,,,,,,,,,,,,"Primary Somatosensory Area, Barrel Field (Mba)    MBA:329",primary auditory cortex (paxrat)    PAXRAT:791
,,,,,,,,,,,,,,,,,,,,,,,,,"Primary Somatosensory Area, Barrel Field, Layer 1 (Mba)    MBA:981",primary fissure (paxrat)    PAXRAT:792
,,,,,,,,,,,,,,,,,,,,,,,,,"Primary Somatosensory Area, Barrel Field, Layer 2/3 (Mba)    MBA:201",primary motor cortex (paxrat)    PAXRAT:793
,,,,,,,,,,,,,,,,,,,,,,,,,"Primary Somatosensory Area, Barrel Field, Layer 4 (Mba)    MBA:1047",primary somatosensory cortex (paxrat)    PAXRAT:794
,,,,,,,,,,,,,,,,,,,,,,,,,"Primary Somatosensory Area, Barrel Field, Layer 5 (Mba)    MBA:1070",primary somatosensory cortex-barrel field (paxrat)    PAXRAT:795
,,,,,,,,,,,,,,,,,,,,,,,,,"Primary Somatosensory Area, Barrel Field, Layer 6A (Mba)    MBA:1038",primary somatosensory cortex-dysgranular zone (paxrat)    PAXRAT:796
,,,,,,,,,,,,,,,,,,,,,,,,,"Primary Somatosensory Area, Barrel Field, Layer 6B (Mba)    MBA:1062",primary somatosensory cortex-forelimb region (paxrat)    PAXRAT:797
,,,,,,,,,,,,,,,,,,,,,,,,,"Primary Somatosensory Area, Layer 1 (Mba)    MBA:793",primary somatosensory cortex-hindlimb region (paxrat)    PAXRAT:798
,,,,,,,,,,,,,,,,,,,,,,,,,"Primary Somatosensory Area, Layer 2/3 (Mba)    MBA:346",primary somatosensory cortex-jaw region (paxrat)    PAXRAT:799
,,,,,,,,,,,,,,,,,,,,,,,,,"Primary Somatosensory Area, Layer 4 (Mba)    MBA:865",primary somatosensory cortex-jaw region-oral surface (paxrat)    PAXRAT:800
,,,,,,,,,,,,,,,,,,,,,,,,,"Primary Somatosensory Area, Layer 5 (Mba)    MBA:921",primary somatosensory cortex-oral dysgranular zone (paxrat)    PAXRAT:801
,,,,,,,,,,,,,,,,,,,,,,,,,"Primary Somatosensory Area, Layer 6A (Mba)    MBA:686",primary somatosensory cortex-shoulder region (paxrat)    PAXRAT:802
,,,,,,,,,,,,,,,,,,,,,,,,,"Primary Somatosensory Area, Layer 6B (Mba)    MBA:719",primary somatosensory cortex-trunk region (paxrat)    PAXRAT:803
,,,,,,,,,,,,,,,,,,,,,,,,,"Primary Somatosensory Area, Lower Limb (Mba)    MBA:337",primary somatosensory cortex-upper lip region (paxrat)    PAXRAT:804
,,,,,,,,,,,,,,,,,,,,,,,,,"Primary Somatosensory Area, Lower Limb, Layer 1 (Mba)    MBA:1030",primary visual cortex (paxrat)    PAXRAT:805
,,,,,,,,,,,,,,,,,,,,,,,,,"Primary Somatosensory Area, Lower Limb, Layer 2/3 (Mba)    MBA:113",primary visual cortex-binocular area (paxrat)    PAXRAT:806
,,,,,,,,,,,,,,,,,,,,,,,,,"Primary Somatosensory Area, Lower Limb, Layer 4 (Mba)    MBA:1094",primary visual cortex-monocular area (paxrat)    PAXRAT:807
,,,,,,,,,,,,,,,,,,,,,,,,,"Primary Somatosensory Area, Lower Limb, Layer 5 (Mba)    MBA:1128",principal mammillary tract (paxrat)    PAXRAT:808
,,,,,,,,,,,,,,,,,,,,,,,,,"Primary Somatosensory Area, Lower Limb, Layer 6A (Mba)    MBA:478",principal sensory trigeminal nucleus (paxrat)    PAXRAT:809
,,,,,,,,,,,,,,,,,,,,,,,,,"Primary Somatosensory Area, Lower Limb, Layer 6B (Mba)    MBA:510",principal sensory trigeminal nucleus-dorsomedial part (paxrat)    PAXRAT:810
,,,,,,,,,,,,,,,,,,,,,,,,,"Primary Somatosensory Area, Mouth (Mba)    MBA:345",principal sensory trigeminal nucleus-ventrolateral part (paxrat)    PAXRAT:811
,,,,,,,,,,,,,,,,,,,,,,,,,"Primary Somatosensory Area, Mouth, Layer 1 (Mba)    MBA:878",prosubiculum (paxrat)    PAXRAT:813
,,,,,,,,,,,,,,,,,,,,,,,,,"Primary Somatosensory Area, Mouth, Layer 2/3 (Mba)    MBA:657",pyramidal cell layer of the hippocampus (paxrat)    PAXRAT:815
,,,,,,,,,,,,,,,,,,,,,,,,,"Primary Somatosensory Area, Mouth, Layer 4 (Mba)    MBA:950",pyramidal decussation (paxrat)    PAXRAT:816
,,,,,,,,,,,,,,,,,,,,,,,,,"Primary Somatosensory Area, Mouth, Layer 5 (Mba)    MBA:974",pyramidal fissure (paxrat)    PAXRAT:817
,,,,,,,,,,,,,,,,,,,,,,,,,"Primary Somatosensory Area, Mouth, Layer 6A (Mba)    MBA:1102",pyramidal tract (paxrat)    PAXRAT:818
,,,,,,,,,,,,,,,,,,,,,,,,,"Primary Somatosensory Area, Mouth, Layer 6B (Mba)    MBA:2",r1 reticular formation (paxrat)    PAXRAT:819
,,,,,,,,,,,,,,,,,,,,,,,,,"Primary Somatosensory Area, Nose (Mba)    MBA:353",r2 reticular formation (paxrat)    PAXRAT:820
,,,,,,,,,,,,,,,,,,,,,,,,,"Primary Somatosensory Area, Nose, Layer 1 (Mba)    MBA:558",r3 reticular formation (paxrat)    PAXRAT:821
,,,,,,,,,,,,,,,,,,,,,,,,,"Primary Somatosensory Area, Nose, Layer 2/3 (Mba)    MBA:838",radiatum layer of the hippocampus (paxrat)    PAXRAT:822
,,,,,,,,,,,,,,,,,,,,,,,,,"Primary Somatosensory Area, Nose, Layer 4 (Mba)    MBA:654",raphe interpositus nucleus (paxrat)    PAXRAT:823
,,,,,,,,,,,,,,,,,,,,,,,,,"Primary Somatosensory Area, Nose, Layer 5 (Mba)    MBA:702",raphe magnus nucleus (paxrat)    PAXRAT:824
,,,,,,,,,,,,,,,,,,,,,,,,,"Primary Somatosensory Area, Nose, Layer 6A (Mba)    MBA:889",raphe obscurus nucleus (paxrat)    PAXRAT:825
,,,,,,,,,,,,,,,,,,,,,,,,,"Primary Somatosensory Area, Nose, Layer 6B (Mba)    MBA:929",raphe pallidus nucleus (paxrat)    PAXRAT:826
,,,,,,,,,,,,,,,,,,,,,,,,,"Primary Somatosensory Area, Trunk (Mba)    MBA:361",recess of the inferior colliculus (paxrat)    PAXRAT:827
,,,,,,,,,,,,,,,,,,,,,,,,,"Primary Somatosensory Area, Trunk, Layer 1 (Mba)    MBA:1006",red nucleus (paxrat)    PAXRAT:828
,,,,,,,,,,,,,,,,,,,,,,,,,"Primary Somatosensory Area, Trunk, Layer 2/3 (Mba)    MBA:670",red nucleus-lateral horn (paxrat)    PAXRAT:829
,,,,,,,,,,,,,,,,,,,,,,,,,"Primary Somatosensory Area, Trunk, Layer 4 (Mba)    MBA:1086",red nucleus-magnocellular part (paxrat)    PAXRAT:830
,,,,,,,,,,,,,,,,,,,,,,,,,"Primary Somatosensory Area, Trunk, Layer 5 (Mba)    MBA:1111",red nucleus-parvicellular part (paxrat)    PAXRAT:831
,,,,,,,,,,,,,,,,,,,,,,,,,"Primary Somatosensory Area, Trunk, Layer 6A (Mba)    MBA:9",region where VA and VL overlap (paxrat)    PAXRAT:832
,,,,,,,,,,,,,,,,,,,,,,,,,"Primary Somatosensory Area, Trunk, Layer 6B (Mba)    MBA:461",reticluostrial nucleus (paxrat)    PAXRAT:833
,,,,,,,,,,,,,,,,,,,,,,,,,"Primary Somatosensory Area, Unassigned (Mba)    MBA:182305689",reticular thalamic nucleus (paxrat)    PAXRAT:834
,,,,,,,,,,,,,,,,,,,,,,,,,"Primary Somatosensory Area, Unassigned, Layer 1 (Mba)    MBA:182305693",reticulotegmental nucleus of the pons (paxrat)    PAXRAT:835
,,,,,,,,,,,,,,,,,,,,,,,,,"Primary Somatosensory Area, Unassigned, Layer 2/3 (Mba)    MBA:182305697",reticulotegmental nucleus of the pons-lateral part (paxrat)    PAXRAT:836
,,,,,,,,,,,,,,,,,,,,,,,,,"Primary Somatosensory Area, Unassigned, Layer 4 (Mba)    MBA:182305701",reticulotegmental nucleus of the pons-pericentral part (paxrat)    PAXRAT:837
,,,,,,,,,,,,,,,,,,,,,,,,,"Primary Somatosensory Area, Unassigned, Layer 5 (Mba)    MBA:182305705",retroambiguus nucleus (paxrat)    PAXRAT:838
,,,,,,,,,,,,,,,,,,,,,,,,,"Primary Somatosensory Area, Unassigned, Layer 6A (Mba)    MBA:182305709",retrochiasmatic area (paxrat)    PAXRAT:839
,,,,,,,,,,,,,,,,,,,,,,,,,"Primary Somatosensory Area, Unassigned, Layer 6B (Mba)    MBA:182305713",retrochiasmatic area-lateral part (paxrat)    PAXRAT:840
,,,,,,,,,,,,,,,,,,,,,,,,,"Primary Somatosensory Area, Upper Limb (Mba)    MBA:369",retroendopiriform nucleus (paxrat)    PAXRAT:841
,,,,,,,,,,,,,,,,,,,,,,,,,"Primary Somatosensory Area, Upper Limb, Layer 1 (Mba)    MBA:450",retroethmoid nucleus (paxrat)    PAXRAT:842
,,,,,,,,,,,,,,,,,,,,,,,,,"Primary Somatosensory Area, Upper Limb, Layer 2/3 (Mba)    MBA:854",retrolemniscal nucleus (paxrat)    PAXRAT:843
,,,,,,,,,,,,,,,,,,,,,,,,,"Primary Somatosensory Area, Upper Limb, Layer 4 (Mba)    MBA:577",retroparafascicular nucleus (paxrat)    PAXRAT:844
,,,,,,,,,,,,,,,,,,,,,,,,,"Primary Somatosensory Area, Upper Limb, Layer 5 (Mba)    MBA:625",retrorubral field (paxrat)    PAXRAT:845
,,,,,,,,,,,,,,,,,,,,,,,,,"Primary Somatosensory Area, Upper Limb, Layer 6A (Mba)    MBA:945",retrorubral nucleus (paxrat)    PAXRAT:846
,,,,,,,,,,,,,,,,,,,,,,,,,"Primary Somatosensory Area, Upper Limb, Layer 6B (Mba)    MBA:1026",retrosplenial agranular cortex (paxrat)    PAXRAT:847
,,,,,,,,,,,,,,,,,,,,,,,,,Primary Visual Area (Mba)    MBA:385,retrosplenial dysgranular cortex (paxrat)    PAXRAT:848
,,,,,,,,,,,,,,,,,,,,,,,,,"Primary Visual Area, Layer 1 (Mba)    MBA:593",retrosplenial granular cortex (paxrat)    PAXRAT:849
,,,,,,,,,,,,,,,,,,,,,,,,,"Primary Visual Area, Layer 2/3 (Mba)    MBA:821",retrosplenial granular cortex-a region (paxrat)    PAXRAT:850
,,,,,,,,,,,,,,,,,,,,,,,,,"Primary Visual Area, Layer 4 (Mba)    MBA:721",retrosplenial granular cortex-b region (paxrat)    PAXRAT:851
,,,,,,,,,,,,,,,,,,,,,,,,,"Primary Visual Area, Layer 5 (Mba)    MBA:778",retrosplenial granular cortex-c region (paxrat)    PAXRAT:852
,,,,,,,,,,,,,,,,,,,,,,,,,"Primary Visual Area, Layer 6A (Mba)    MBA:33",retrouniens area (paxrat)    PAXRAT:853
,,,,,,,,,,,,,,,,,,,,,,,,,"Primary Visual Area, Layer 6B (Mba)    MBA:305",reuniens thalamic nucleus (paxrat)    PAXRAT:854
,,,,,,,,,,,,,,,,,,,,,,,,,Principal Sensory Nucleus Of The Trigeminal (Mba)    MBA:7,rhabdoid nucleus (paxrat)    PAXRAT:855
,,,,,,,,,,,,,,,,,,,,,,,,,Prosubiculum (Mba)    MBA:484682470,rhinal fissure (paxrat)    PAXRAT:856
